Kothrud,Vijay Sales,18.510808,73.8182,Paud Rd. Rambaug Colony,25,Electronics Sale
Kothrud,Jaihind,18.504857,73.821834,Next to McD Off Karve Road,40,Monsoon Offers
Kothrud,HP World,18.50194,73.821715,Fountain Head Bldg. Sangam Press Rd,15,Electronics Sale
Kothrud,CottonKing,18.499123,73.813483,Kakade Complex Sutar PMT Stand,50,Fashion Sale
Kothrud,Croma,18.498783,73.821771,Giridhar Avenue. Ground Floor,30,Electronics Sale
Kothrud,McDonald's,18.507973,73.796555,Paud Road Bhusari Colony,60,Summer Discounts
Kothrud,Megamart,18.50717,73.804913,Nina Housing Society. Paud Road,50,BIG Monsoon Sale
Kothrud,more Supermarkets,18.502481,73.802459,Shastri Nagar,20,Groceries discounts
PCMC,Ezone,18.636513,73.796191,Premier Plaza Mumbai Pune Hwy Chinchwad,40,Raining Offers
PCMC,Croma,18.625605,73.801888,Shubhan Galleria. Next to Finolx Chowk. Pimpri,20,BIG Monsoon Sale
PCMC,P N Gadgil And Sons,18.630405,73.779242,Chapekar Chowk Flyover. Chinchwad,10,Discounts
PCMC,MRF Tyres,18.630349,73.776978,Kai Dhondu Chinchwade Rd. Chinchwad,30,BIG Sale
PCMC,City One Mall,18.633064,73.800434,Finolex Chowk Pimrpi,25,Today's Discount
Laxmi Road,Shagun,18.513764,73.847312, Umbariya Ganpati Chowk. Laxmi Road,30,Fashion Sale
Laxmi Road,Chocolate Kids,18.514304,73.852349,Laxmi Road.Kunte Chowk,50,Super Sale
Laxmi Road,Linen Club The Ramp,18.514558,73.852728,Saraswati Vilas Bldg. Laxmi Road,40,Clearance Sale
Laxmi Road,Waman Hari Pethe Sons,18.514103,73.848814,Laxmi Road. Narayan Peth,20,Incredible Discounts
Laxmi Road,Pallod Collection,18.513146,73.844517,Alka Talkies. Laxmi Rd. Narayan Peth,50,BIG Sale
Laxmi Road,John Players,18.514327,73.850751,Laxmi Rd. Bhatancha Bol,20,Exclusive offers for You
Laxmi Road,Duckback Seasonal House,18.515568,73.856027,City Post Chowk. Tulshibaug,50,Super Sale
Mumbai,Oh! Calcutta,19.139552,72.826462,Lokhandwala Complex. Andheri (West),25,Today's Discount
Mumbai,Infiniti Mall,19.141129,72.831084,New Link Road. Oshiwara. Andheri West,30,Special Offer
Mumbai,Barbeque Nation,19.136061,72.833294,Lokhandwala Ground Floor Andheri West,40,Monsoon Offers
Mumbai,Hard Rock Cafe,19.135959,72.835397,Fun Cinema Lane. Andheri West,15,Exclusive discounts
Mumbai,Boveda,19.14046,72.833229,Off Oshiwara Link Road. Morya Landmark 1 Andheri West,20,BIG Sale
Mumbai,Indigo Delicatessen,19.136385,72.8275,Lokhandwala Andheri West,10,Today's Deal
Mumbai,Banana Leaf,19.125215,72.822694,Shubham CHS. 7 Bungalows. Andheri West,5,SALE
Dubai,Lamcy Plaza,25.234404,55.307869,Sheikh Rashid Road Bur Dubai,20,Today's Discount
Dubai,Dubai Duty Free,25.247547,55.354486,Dubai International Airport,30,Exclusive discounts
Dubai,City Centre Deira,25.252204,55.331998,8th St. Dubai,40,Summer SALE
Dubai,Sharaf DG,25.13928,55.219216,Dubai. Times Square Center Dubai,30,Incredible Discounts
Dubai,Jumbo Unwired - Dubai Mall,25.196774,55.278327,Dubai Mall,50,Spring Sale Save upto 50%
Dubai,KRIS KROS,25.199454,55.273638,Boulevard Plaza. Sheikh Mohammed bin Rashid Blvd,40,BIG Sale
Dubai,Scoozi,25.198046,55.27823,Dubai Mall. Dubai,10,Fashion Offer
